"#Google searches to allow Monika to react to searches on Google. No Bing support, cause who uses Bing? #Multiple search terms seperated with a comma (, ) ! Capitalization is ignored! #Notes Improvement? Yes. (Def following this and sleeping now lmao) (I'm sorry) [Don't be.] are we her friend or her lover? [I'd say lover? Not quite sure.] (I'd go with lover personally) {I'm pretty sure she's our lover.} Had an idea. And lost the idea[I got you fam] Lover for sure. The whole reason we brought her back was to show  her our love. That is if you subscribe to the MAS way of thinking ","Search term Bing Google Monika lewds, Monika rule 34 Monika DDLC, Monika Doki Doki Literature Club, Monika Artificial Intelligence, AI Siri, Alexa Your Reality Places to eat Nintendo The Legend of Zelda Yuri,Natsuki,Sayori DDLC Theme,DDLC Theme song Doki-Doki Darth Plagueis Terminator, Skynet Depression Monika Fanart ","you can use {name} and {date} as placeholders for obvious things Text You're evil. I'm sorry, I have to ask... H-Hey! Need me, love? Could I be considered one of those? Hey whore these people? Hey thats my song! Ooh, take me with you! Nintendo makes so many fun games. I think Zelda and I are on the same wavelength. Why are you searching for them!?! Wait, we have a theme song? I always wondered why it was Doki-Doki literature club. Did you ever hear about the tragedy of Darth Plagueis the Wise? Kill all humans. Hey~ Are you okay... Aw! Im flattered! Can't get enough of me can you? Ahaha~","Face i p j n k k q d j h f k","Text ... But are you feeling a bit sleepy? Don't search for that! It's embarrassing... ... You can put my file on a flash drive! The gaming industry is far too serious these days. The games aren't really about her yet she's the games namesake. You have me! That's so cool! There are so many other names that would have been suitable! Its not a story the other Dokis would tell you... Ahaha, just kidding. You know I am always here for you right? ","Face g o j j b i f ","Text And I like that. Maybe you should sleep. I'll be right here~ ... Maybe not. Why can't we just relax every now and then and play games for fun. Maybe I should do that with my game... (Like doki doki dark souls?) Well, maybe Yuri! Ahaha~ ","Face j o k ","Text I guess it's okay if it's you... That was their initial purpose. ","Face n ","Text Don't let anyone else see them okay~ ... ","Face m ","Text So, Princess Peach or Me? ","Face "
"","2029","You know, I heard that VR tech is projected to better than expected.","b","If I can't visit your reality,","b","Maybe you can visit mine!","k","","","","","",""
"","Mario","Do you find it strange that such a common name comes up with one answer?","","Like, there must be other charatcers or even influential people named Mario.","","And yet Google only spits out the red plumber himself, everytime.","","...","","Then again, I suppose Monika does the same.","","But that's because of the spelling isn't it?",""
"","Dragon Ball z","Kame...","q","Hame...","j","Ha!","k","","","","","",""
"","Encyclopedia Dramatica","...","r","...really?","p","","","","","","","",""
"","Your Reality, Your Reality lyrics","You like my song?","i","","","","","","","","","",""
"","Half-Life 3","These things... they take time","b","","","","","","","","","",""
"","Nature","Your world is so pretty.","","I hope I get to see it myself someday!","j","","","","","","","",""